{
  "$schema": "../config/capability-map.schema.json",
  "version": "1.0.0",
  "description": "🎯 统一能力映射表 - 将用户意图映射到具体的执行能力组合",
  "metadata": {
    "created_at": "2026-01-16T10:00:00Z",
    "last_updated": "2026-01-17T14:00:00Z",
    "author": "wangqiqi",
    "compatibility": ">=4.0.0"
  },
  "global_config": {
    "default_execution_timeout": 300000,
    "max_parallel_executions": 3,
    "error_handling_strategy": "graceful_degradation",
    "logging_level": "info",
    "telemetry_enabled": false,
    "learning_enabled": true,
    "mcp_priority_enabled": true,
    "mcp_fallback_enabled": true
  },
  "mappings": {
    "create_react_project": {
      "description": "创建React项目",
      "intents": [
        "create",
        "project",
        "react",
        "frontend"
      ],
      "confidence_threshold": 0.8,
      "user_examples": [
        "我想创建一个React项目",
        "帮我搭建React应用",
        "新建一个React TypeScript项目"
      ],
      "capabilities": {
        "rules": [
          "conversation_intent_analyzer",
          "generator",
          "templates",
          "javascript"
        ],
        "skills": [
          "frontend-design",
          "webapp-testing"
        ],
        "scripts": [
          "core/init.sh",
          "core/env-perception.sh",
          "core/config-manager.sh"
        ],
        "workflows": [
          "project-init",
          "dependency-install",
          "config-setup"
        ],
        "hooks": []
      },
      "execution_order": [
        "perception",
        "rules",
        "scripts",
        "skills",
        "workflows"
      ],
      "parameters": {
        "project_type": "react",
        "language": "typescript",
        "template": "standard"
      },
      "validation_rules": {
        "required_tools": [
          "node",
          "npm"
        ],
        "min_node_version": "16.0.0"
      },
      "fallback_strategies": [
        "scaffold-basic",
        "manual-guide"
      ]
    },
    "create_vue_project": {
      "description": "创建Vue项目",
      "intents": [
        "create",
        "project",
        "vue",
        "frontend"
      ],
      "confidence_threshold": 0.8,
      "user_examples": [
        "我想创建一个Vue项目",
        "帮我搭建Vue应用",
        "新建一个Vue 3项目"
      ],
      "capabilities": {
        "rules": [
          "conversation_intent_analyzer",
          "generator",
          "templates",
          "javascript"
        ],
        "skills": [
          "frontend-design",
          "webapp-testing"
        ],
        "scripts": [
          "core/init.sh",
          "core/env-perception.sh"
        ],
        "workflows": [
          "project-init",
          "dependency-install",
          "config-setup"
        ],
        "hooks": []
      },
      "execution_order": [
        "perception",
        "rules",
        "scripts",
        "skills",
        "workflows"
      ],
      "parameters": {
        "project_type": "vue",
        "language": "typescript",
        "template": "vue3"
      },
      "validation_rules": {
        "required_tools": [
          "node",
          "npm"
        ],
        "min_node_version": "16.0.0"
      }
    },
    "create_python_api": {
      "description": "创建Python API项目",
      "intents": [
        "create",
        "project",
        "python",
        "api",
        "backend"
      ],
      "confidence_threshold": 0.8,
      "user_examples": [
        "我想创建一个Python API",
        "帮我搭建FastAPI应用",
        "新建一个Django REST项目"
      ],
      "capabilities": {
        "rules": [
          "conversation_intent_analyzer",
          "generator",
          "templates",
          "python"
        ],
        "skills": [
          "webapp-testing"
        ],
        "scripts": [
          "core/init.sh",
          "core/env-perception.sh"
        ],
        "workflows": [
          "project-init",
          "dependency-install",
          "config-setup"
        ],
        "hooks": []
      },
      "execution_order": [
        "perception",
        "rules",
        "scripts",
        "skills",
        "workflows"
      ],
      "parameters": {
        "project_type": "python-api",
        "framework": "fastapi",
        "template": "rest-api"
      },
      "validation_rules": {
        "required_tools": [
          "python3",
          "pip"
        ],
        "min_python_version": "3.8.0"
      }
    },
    "check_code_quality": {
      "description": "检查代码质量",
      "intents": [
        "check",
        "quality",
        "code",
        "lint",
        "audit"
      ],
      "confidence_threshold": 0.7,
      "user_examples": [
        "检查代码质量",
        "运行代码检查",
        "代码质量审计",
        "修复代码问题"
      ],
      "capabilities": {
        "rules": [
          "eslint",
          "intelligent_evolution"
        ],
        "skills": [],
        "scripts": [
          "core/quality-manager.sh"
        ],
        "workflows": [
          "lint",
          "audit",
          "report"
        ],
        "hooks": [
          "code-quality.sh"
        ]
      },
      "execution_order": [
        "rules",
        "scripts",
        "hooks",
        "workflows"
      ],
      "parameters": {
        "scope": "all",
        "fix_issues": true,
        "generate_report": true
      },
      "quality_gates": {
        "max_warnings": 10,
        "max_errors": 0,
        "coverage_min": 80
      }
    },
    "commit_code": {
      "description": "智能提交代码到Git (增强版)",
      "intents": [
        "commit",
        "git",
        "save",
        "push",
        "提交代码",
        "git commit",
        "保存更改",
        "推送代码"
      ],
      "confidence_threshold": 0.9,
      "user_examples": [
        "提交代码",
        "git commit",
        "保存更改",
        "推送代码",
        "智能提交",
        "标准化提交"
      ],
      "smart_matching": {
        "enabled": true,
        "fuzzy_matching": {
          "enabled": true,
          "similarity_threshold": 0.8,
          "levenshtein_distance": 2
        },
        "synonym_support": {
          "enabled": true,
          "synonyms": {
            "提交": [
              "commit",
              "保存",
              "存储",
              "入库",
              "checkin"
            ],
            "代码": [
              "code",
              "源码",
              "程序",
              "文件",
              "changes"
            ],
            "更改": [
              "修改",
              "变更",
              "更新",
              "变动",
              "changes"
            ],
            "推送": [
              "push",
              "上传",
              "发布",
              "同步",
              "upload"
            ],
            "智能": [
              "smart",
              "自动",
              "智慧",
              "智能",
              "auto"
            ],
            "标准化": [
              "standard",
              "规范",
              "统一",
              "standardized"
            ]
          }
        },
        "punctuation_handling": {
          "enabled": true,
          "ignore_punctuation": [
            "!",
            "？",
            "?",
            ".",
            "。",
            ",",
            "，",
            ":",
            "："
          ],
          "normalize_spaces": true
        },
        "semantic_rules": {
          "enabled": true,
          "intent_patterns": [
            {
              "pattern": "(提交|保存|commit).*?(代码|更改|文件)",
              "confidence_boost": 0.2,
              "context_keywords": [
                "git",
                "版本控制",
                "代码库"
              ]
            },
            {
              "pattern": "(推送|上传|push).*?(代码|更改)",
              "confidence_boost": 0.15,
              "implies_commit": true
            },
            {
              "pattern": "(智能|自动|智慧).*?(提交|保存)",
              "confidence_boost": 0.1,
              "preferred_script": "enhanced-git-commit.sh"
            }
          ]
        },
        "context_awareness": {
          "enabled": true,
          "git_context": {
            "check_uncommitted": true,
            "check_staged": true,
            "boost_if_changes": 0.3
          },
          "project_context": {
            "check_cursor_dir": true,
            "boost_if_cursor_project": 0.2
          }
        }
      },
      "capabilities": {
        "rules": [
          "intelligent_evolution",
          "conventional_commits"
        ],
        "scripts": [
          "core/enhanced-git-commit.sh"
        ],
        "hooks": [
          "features/hooks/pre-commit-analyzer.sh",
          "features/hooks/commit-message-validator.sh",
          "features/hooks/code-quality.sh",
          "features/hooks/consistency-check.sh",
          "features/hooks/post-commit-logger.sh"
        ],
        "mcp_tools": [
          {
            "intent": "git_intelligent_commit",
            "tool": "mcp_git_smart_commit",
            "server": "mcp-git",
            "priority": "high"
          }
        ],
        "workflows": [
          "enhanced-analysis",
          "standard-commit",
          "quality-assurance",
          "post-commit-logging"
        ]
      },
      "execution_order": [
        "hooks",
        "mcp_tools",
        "scripts",
        "workflows"
      ],
      "parameters": {
        "auto_stage": true,
        "deep_analysis": true,
        "conventional_commits": true,
        "quality_checks": true,
        "mcp_enhancement": true,
        "push_after_commit": false,
        "generate_changelog": false
      },
      "validation_rules": {
        "message_format": "type(scope): description",
        "max_line_length": 72,
        "require_conventional_commits": true,
        "complexity_analysis": true,
        "quality_gates": true
      }
    },
    "enhanced_commit": {
      "description": "增强版智能Git提交 (深度分析+MCP+标准化)",
      "intents": [
        "enhanced_commit",
        "smart_commit",
        "standard_commit",
        "advanced_commit",
        "提交代码",
        "智能提交",
        "标准化提交"
      ],